### ISSUE TITLE
Occasional connection losses

### ISSUE THREAD

**Issue by L-U-T-i** [TigerVNC/tigervnc#2148]
I am noticing occasional connection losses recently (for a couple of months or so already; not before 1.16 for sure). The remote screen just freezes, and never comes back. Restarting the connection works well (I use shared connections on server side). I am not 100% sure, but it seems it happens during a high CPU load on server (when building some application for instance).

1. Connect to the most recent TigerVNC (git snapshot master branch) X11 vnc server (linux)
2. Have the remote connection opened for some time (can be days sometimes)
3. You shall suddenly find the remote screen frozen. Just waiting doesn't resolve it, you have to close the connection (client) and start a new connection (you find everything on the remote side went through in between, and is sunning smoothly all the time...); server restart is not needed

Expected behavior:
Connection to remote TigerVNC server not to break (or, at least to recover)

Client:
 - OS: Rocky Linux 9.8 (RHEL-9)
 - VNC client: TigerVNC
 - VNC client version:  always the latest git snapshot  - currently 1.16.80-0.5.git20260821.ff59f40
 - Client downloaded from: custom build, RPM spec file based on RHEL / Fedora and TigerVNC provided one 

Server:
 - OS: Rocky Linux 9.8 (RHEL-9)
 - VNC server:TigerVNC
 - VNC server version: always the latest git snapshot  - currently 1.16.80-0.5.git20260821.ff59f40
 - Server downloaded from: custom build, RPM spec file based on RHEL / Fedora and TigerVNC provided one
 - Server was started using: /usr/lib/systemd/system/vncserver@.service (ExecStart=-/usr/bin/Xvnc -inetd -query localhost -geometry 1024x768 -depth 24 -once -SecurityTypes=None)

**Comment by CendioOssman** [comment]
Difficult to say what's going on without more information. Usually this is caused by network firewalls that start dropping or blocking things.

Is the session idle when this happens? Or can is suddenly stop working as you are interacting with it?

Can you monitor the network traffic using tcpdump when this happens? We need to see what packets are flowing, if any.

**Comment by L-U-T-i** [comment]
I know it is difficult... Otherwise, I would be able to provide more details about.

I don't think is it network, it happens also on LAN (100 Mbps Ethernet, not overloaded by far).

The session is often not idle, it happens when I interact with it. As said, I have a virtual server for package building processes (among the other things, of course), and I've noticed it many times during the building process (when the running rpmbuild raises CPU load significantly), while I do also other things in between (copy .spec file, generate a .diff comparing to the old one etc.).

I have no experience with tcpdump at all. What exactly shall I do, and how?

But, I don't thing it is network. I suspect there is some communication between a server and a client part, and server somehow miss to send some info to the client (because of 100% CPU load or so). Or, doesn't send it in time for the client to consider it. And, there is no process to recover that after. Is it possible something like that to occur?

**Comment by CendioOssman** [comment]
TCP is very robust, so load should not be able to break any communication, only delay it.

You said this was a recent change. It would help if you could confirm that and pinpoint which version the issue appeared.

tcpdump can be run like this:

```console
$ sudo tcpdump -i any host server.example.com and port 5900
```

The above port assume display `:0`. Increase it if a higher display is used.

**Comment by L-U-T-i** [comment]
It is interesting, it happened on Fast Ethernet LAN twice already:
- With a relatively high server load, VNC screen freezes, and doesn't come back no matter how long you wait (OK, some minutes in my case, but should be more than enough...)
- I've minimized TigerVNC client window and ran tcpdump as above
- tcpdump manifests no traffic at all, until I restore TigerVNC client window (unminimize)
- after that, everything runs back as expected

My conclusion is that TigerVNC client doesn't receive something from server in time, so it concludes traffic is not needed until further. After minimizing and restoring TigerVNC client window, client contacts server for a screen update, what successfully restores the connection.

Any clue?

**Comment by CendioOssman** [comment]
We don't do anything special on minimize or restore, so I'm afraid the issue must be something else.

Was anything supposed to be updating on the screen at this time? Or were the applications idle?

Next time, please run tcpdump whilst the client window is visible. There should be traffic from mouse movements and keyboard presses.

Do you have the tcpdump from your test run? It would be interesting to see what the first few packets were when things resumed.

**Comment by L-U-T-i** [comment]
The screen has been updating all the time, as there was an RPM build process running. At the same time, I've been doing something (with file manager or text editor, don't remember...) and that's how I noticed the freeze...

Here are the first packets:
```
# sudo tcpdump -i any host 192.168.0.10 and port 5903
tcpdump: data link type LINUX_SLL2
dropped privs to tcpdump
tcpdump: verbose output suppressed, use -v[v]... for full protocol decode
listening on any, link-type LINUX_SLL2 (Linux cooked v2), snapshot length 262144 bytes
07:08:57.662601 br0   Out IP 192.168.0.200.47394 > 192.168.0.10.5903: Flags [P.], seq 3038660512:3038660569, ack 1272212046, win 28314, options [nop,nop,TS val 35022468 ecr 3189377724], length 57
07:08:57.662609 enp0s31f6 Out IP 192.168.0.200.47394 > 192.168.0.10.5903: Flags [P.], seq 0:57, ack 1, win 28314, options [nop,nop,TS val 35022468 ecr 3189377724], length 57
07:08:57.662923 enp0s31f6 In  IP 192.168.0.10.5903 > 192.168.0.200.47394: Flags [.], ack 57, win 3131, options [nop,nop,TS val 3189395730 ecr 35022468], length 0
07:08:57.662923 br0   In  IP 192.168.0.10.5903 > 192.168.0.200.47394: Flags [.], ack 57, win 3131, options [nop,nop,TS val 3189395730 ecr 35022468], length 0
07:08:57.663333 enp0s31f6 In  IP 192.168.0.10.5903 > 192.168.0.200.47394: Flags [P.], seq 1:74, ack 57, win 3131, options [nop,nop,TS val 3189395730 ecr 35022468], length 73
07:08:57.663333 br0   In  IP 192.168.0.10.5903 > 192.168.0.200.47394: Flags [P.], seq 1:74, ack 57, win 3131, options [nop,nop,TS val 3189395730 ecr 35022468], length 73
07:08:57.669974 br0   Out IP 192.168.0.200.47394 > 192.168.0.10.5903: Flags [P.], seq 57:162, ack 74, win 28314, options [nop,nop,TS val 35022476 ecr 3189395730], length 105
07:08:57.669983 enp0s31f6 Out IP 192.168.0.200.47394 > 192.168.0.10.5903: Flags [P.], seq 57:162, ack 74, win 28314, options [nop,nop,TS val 35022476 ecr 3189395730], length 105
07:08:57.672141 enp0s31f6 In  IP 192.168.0.10.5903 > 192.168.0.200.47394: Flags [.], seq 74:1522, ack 162, win 3131, options [nop,nop,TS val 3189395739 ecr 35022476], length 1448
07:08:57.672141 br0   In  IP 192.168.0.10.5903 > 192.168.0.200.47394: Flags [.], seq 74:1522, ack 162, win 3131, options [nop,nop,TS val 3189395739 ecr 35022476], length 1448
07:08:57.672391 enp0s31f6 In  IP 192.168.0.10.5903 > 192.168.0.200.47394: Flags [.], seq 1522:2970, ack 162, win 3131, options [nop,nop,TS val 3189395739 ecr 35022476], length 1448
07:08:57.672393 br0   Out IP 192.168.0.200.47394 > 192.168.0.10.5903: Flags [P.], seq 162:219, ack 1522, win 28314, options [nop,nop,TS val 35022478 ecr 3189395739], length 57
07:08:57.672391 br0   In  IP 192.168.0.10.5903 > 192.168.0.200.47394: Flags [.], seq 1522:2970, ack 162, win 3131, options [nop,nop,TS val 3189395739 ecr 35022476], length 1448
07:08:57.672398 enp0s31f6 Out IP 192.168.0.200.47394 > 192.168.0.10.5903: Flags [P.], seq 162:219, ack 1522, win 28314, options [nop,nop,TS val 35022478 ecr 3189395739], length 57
07:08:57.672646 enp0s31f6 In  IP 192.168.0.10.5903 > 192.168.0.200.47394: Flags [.], seq 2970:4418, ack 162, win 3131, options [nop,nop,TS val 3189395739 ecr 35022476], length 1448
07:08:57.672646 br0   In  IP 192.168.0.10.5903 > 192.168.0.200.47394: Flags [.], seq 2970:4418, ack 162, win 3131, options [nop,nop,TS val 3189395739 ecr 35022476], length 1448
07:08:57.672898 enp0s31f6 In  IP 192.168.0.10.5903 > 192.168.0.200.47394: Flags [.], seq 4418:7314, ack 162, win 3131, options [nop,nop,TS val 3189395740 ecr 35022476], length 2896
07:08:57.672898 br0   In  IP 192.168.0.10.5903 > 192.168.0.200.47394: Flags [.], seq 4418:7314, ack 162, win 3131, options [nop,nop,TS val 3189395740 ecr 35022476], length 2896
07:08:57.673150 enp0s31f6 In  IP 192.168.0.10.5903 > 192.168.0.200.47394: Flags [P.], seq 7314:10210, ack 162, win 3131, options [nop,nop,TS val 3189395740 ecr 35022476], length 2896
07:08:57.673150 br0   In  IP 192.168.0.10.5903 > 192.168.0.200.47394: Flags [P.], seq 7314:10210, ack 162, win 3131, options [nop,nop,TS val 3189395740 ecr 35022476], length 2896
07:08:57.673405 enp0s31f6 In  IP 192.168.0.10.5903 > 192.168.0.200.47394: Flags [.], seq 10210:13106, ack 219, win 3131, options [nop,nop,TS val 3189395740 ecr 35022478], length 2896
07:08:57.673405 br0   In  IP 192.168.0.10.5903 > 192.168.0.200.47394: Flags [.], seq 10210:13106, ack 219, win 3131, options [nop,nop,TS val 3189395740 ecr 35022478], length 2896
07:08:57.673666 enp0s31f6 In  IP 192.168.0.10.5903 > 192.168.0.200.47394: Flags [.], seq 13106:16002, ack 219, win 3131, options [nop,nop,TS val 3189395740 ecr 35022478], length 2896
07:08:57.673666 br0   In  IP 192.168.0.10.5903 > 192.168.0.200.47394: Flags [.], seq 13106:16002, ack 219, win 3131, options [nop,nop,TS val 3189395740 ecr 35022478], length 2896

```
