### ISSUE TITLE
TigerVNC Doesn't Currently Run Under MacOS Sequoia

### ISSUE THREAD

**Issue by takuhii** [TigerVNC/tigervnc#1764]
**Describe the bug**
Doesn't work on MacOS Sequoia Dev Beta (24A5264n)

**To Reproduce**
Open TigerVNC on Sequoia, just freezes and beachballs

**Expected behavior**
Expect TigerVNC to run

**Screenshots**
<img width="460" alt="Screenshot 2024-06-14 at 11 00 32" src="https://github.com/TigerVNC/tigervnc/assets/193907/d761ea06-8d59-4a1a-b0b3-f6e7e504b673">
Notice here how the button stays depressed, can't capture the cursor, but the cursor beachballs the whole time Tiger is running.

<img width="432" alt="Screenshot 2024-06-14 at 11 01 47" src="https://github.com/TigerVNC/tigervnc/assets/193907/407d07bc-a47a-419d-ab4d-c9c22eff58ee">

Then it goes straight to this prompt, no moaning about certificates (which it usually does)...

**Client (please complete the following information):**
 - OS: MacOS Sequoia Dev Beta (MacOS 15)
 - VNC client: TigerVNC
 - VNC client version: 1.13.1
 - Client downloaded from: TigerVNC GitHub Release page

**Server (please complete the following information):**
 - OS: Raspbian OS Bookwork
 - VNC server: WayVNC
 - VNC server version: 0.9-dev
 - Server downloaded from: Part of Rasbian OS
 - Server was started using: As part of system startup

**Additional context**
Updated to TigerVNC 1.13.80, same result...

**Comment by CendioOssman** [comment]
Given that it's a beta of macOS, it might simply be a bug there.

The fact that it is unresponsive whilst connecting is a known limitation, though. And given the error message, it might simply be a network issue. Can other VNC clients connect to that server from that macOS machine?

**Comment by takuhii** [comment]
Yes, RealVNC works fine.

**Comment by CendioOssman** [comment]
Can you do a packet trace for a connection attempt by TigerVNC? E.g. tcpdump on the server.

**Comment by takuhii** [comment]
Can you advise on how I would do this? I am on a Mac

**Comment by CendioOssman** [comment]
I'm afraid I'm not familiar with what tools might exist on macOS for this. But you can do it on the server side as well. Run the following:

```console
$ sudo tcpdump -i any port 5900
```

And let us know what it says.

**Comment by takuhii** [comment]
Hi, I just get this...
```
tcpdump: data link type PKTAP
tcpdump: verbose output suppressed, use -v[v]... for full protocol decode
listening on any, link-type PKTAP (Apple DLT_PKTAP), snapshot length 524288 bytes
10:30:44.084859 IP 192.168.1.234.58697 > host81-141-190-37.range81-141.btcentralplus.com.rfb: Flags [S], seq 693010272, win 65535, options [mss 1460,nop,wscale 6,nop,nop,TS val 4209233816 ecr 0,sackOK,eol], length 0
10:31:16.084723 IP 192.168.1.234.58697 > host81-141-190-37.range81-141.btcentralplus.com.rfb: Flags [S], seq 693010272, win 65535, options [mss 1460,sackOK,eol], length 0
10:31:38.151104 IP 192.168.1.234.58845 > host81-141-190-37.range81-141.btcentralplus.com.rfb: Flags [SEWA], seq 734493188, win 65535, options [mss 1460,nop,wscale 6,nop,nop,TS val 3450298448 ecr 0,sackOK,eol], length 0
10:31:39.151581 IP 192.168.1.234.58845 > host81-141-190-37.range81-141.btcentralplus.com.rfb: Flags [SEWA], seq 734493188, win 65535, options [mss 1460,nop,wscale 6,nop,nop,TS val 3450299448 ecr 0,sackOK,eol], length 0
10:31:40.150894 IP 192.168.1.234.58845 > host81-141-190-37.range81-141.btcentralplus.com.rfb: Flags [S], seq 734493188, win 65535, options [mss 1460,nop,wscale 6,nop,nop,TS val 3450300448 ecr 0,sackOK,eol], length 0
```

**Comment by CendioOssman** [comment]
That shows some network issue between macOS and Ubuntu, which is outside our control. :/

Could you do the same dump using RealVNC and include the first few packages? It should have the same issue, so it would be good to see what differs.

**Comment by CendioOssman** [comment]
No response. Closing.
